{
  "$schema": "https://json-schema.org/draft/2020-12/schema",
  "$id": "https://github.com/Nuclominus/Agentic-SDLC-Pluguin/schemas/run.schema.json",
  "title": "SDLC Resolved Run Manifest",
  "description": "The resolved phase DAG for one pipeline run, persisted once at Step 3 start so --resume (and sdlc-lint resume) can compute the re-entry point without re-resolving the workflow.",
  "type": "object",
  "additionalProperties": false,
  "required": ["task_slug", "workflow", "resolved_phases"],
  "properties": {
    "task_slug": { "type": "string", "minLength": 1 },
    "workflow": { "type": "string", "minLength": 1 },
    "stack": { "type": "string" },
    "branch_name": { "type": "string", "minLength": 1 },
    "written_at": { "type": "string", "format": "date-time" },
    "resolved_phases": {
      "type": "array",
      "minItems": 1,
      "items": {
        "type": "object",
        "additionalProperties": false,
        "required": ["name", "kind"],
        "properties": {
          "name": { "type": "string", "minLength": 1 },
          "kind": { "enum": ["plain", "loop", "parallel"] },
          "aspects": {
            "type": ["array", "null"],
            "items": { "type": "string" }
          },
          "members": {
            "type": "array",
            "items": {
              "type": "object",
              "additionalProperties": false,
              "required": ["name"],
              "properties": {
                "name": { "type": "string" },
                "aspects": { "type": ["array", "null"], "items": { "type": "string" } }
              }
            }
          }
        }
      }
    }
  }
}
