{ "task_slug": "parallel-partial", "workflow": "android-feature", "stack": "android",
  "resolved_phases": [
    { "name": "business_analysis", "kind": "plain", "aspects": null },
    { "name": "development", "kind": "plain", "aspects": null },
    { "name": "parallel:security+test", "kind": "parallel", "aspects": null,
      "members": [ { "name": "security", "aspects": null }, { "name": "test", "aspects": null } ] },
    { "name": "documentation", "kind": "plain", "aspects": null } ] }
