{ "task_slug": "branch-mismatch", "workflow": "default", "stack": "android", "branch_name": "feature/other-branch",
  "resolved_phases": [
    { "name": "business_analysis", "kind": "plain", "aspects": null },
    { "name": "development", "kind": "plain", "aspects": ["database", "backend"] },
    { "name": "qa", "kind": "plain", "aspects": null },
    { "name": "security", "kind": "plain", "aspects": null },
    { "name": "documentation", "kind": "plain", "aspects": null } ] }
